{
  "run_id": "run_4d5e6f708192a3b4c5d6e7f8091a2b3c",
  "title": "基于整数规划的共享单车调度优化",
  "abstract": "本文建立整数规划模型求解调度问题，贪心基线 rmse=0.12，稳健性复跑三项检查全部通过。",
  "keywords": ["整数规划", "调度"],
  "sections": [
    { "heading": "1 问题重述", "content": "题目要求给出调度方案……" },
    { "heading": "5 模型建立与求解", "content": "分层订购与运输的建模思路借鉴了赛题先例[1]，贪心近似 rmse=0.12。" },
    { "heading": "参考文献", "content": "[1] 全国大学生数学建模竞赛 2021 2021 CUMCM C. 生产企业原材料的订购与运输[Z]. [来源](https://www.mcm.edu.cn/html_cn/node/2021c.html)\n[2] Nanjing University of Posts & Telecommunications. A Roadmap to a Better City · Team 2504188[Z]. COMAP MCM/ICM 2025，Outstanding Winner. [全文](https://github.com/Jackksonns/MCM-ICM-Outstanding-Papers/blob/d29267cb9e993419749e6111981b30a44183fdf8/2025/D/2504188.pdf)" }
  ],
  "version": 1,
  "updated_at": "2026-09-07T04:20:00.000000Z",
  "frozen_numbers": [
    { "id": "metrics.rmse", "label": "实验指标 rmse", "value": 0.12, "source_stage": "EXPERIMENTING", "source_path": "metrics.rmse" }
  ],
  "audit_findings": [],
  "figures": [],
  "references": [
    {
      "number": 1,
      "title": "生产企业原材料的订购与运输",
      "text": "全国大学生数学建模竞赛 2021 2021 CUMCM C. 生产企业原材料的订购与运输[Z]. [来源](https://www.mcm.edu.cn/html_cn/node/2021c.html)",
      "url": "https://www.mcm.edu.cn/html_cn/node/2021c.html",
      "source": "plan_citation",
      "card_id": "problem:cumcm-2021-c",
      "cited": true,
      "key": "problem_cumcm_2021_c",
      "verification": "source_verified"
    },
    {
      "number": 2,
      "title": "A Roadmap to a Better City · Team 2504188",
      "text": "Nanjing University of Posts & Telecommunications. A Roadmap to a Better City · Team 2504188[Z]. COMAP MCM/ICM 2025，Outstanding Winner. [全文](https://github.com/Jackksonns/MCM-ICM-Outstanding-Papers/blob/d29267cb9e993419749e6111981b30a44183fdf8/2025/D/2504188.pdf)",
      "url": "https://github.com/Jackksonns/MCM-ICM-Outstanding-Papers/blob/d29267cb9e993419749e6111981b30a44183fdf8/2025/D/2504188.pdf",
      "source": "user_reference",
      "card_id": "paper:comap-2025-icm-d-2504188",
      "cited": false,
      "key": "paper_comap_2025_icm_d_2504188",
      "verification": "title_matched"
    },
    {
      "number": 3,
      "title": "无链接的旧卡",
      "text": "某赛事. 无链接的旧卡[Z].",
      "url": null,
      "source": "plan_citation",
      "card_id": null,
      "cited": false
    }
  ]
}
