{
  "run_id": "run_1a2b3c4d5e6f708192a3b4c5d6e7f809",
  "title": "基于整数规划的共享单车调度优化",
  "abstract": "本文建立整数规划模型求解调度问题，并用合成数据验证了方案有效性。",
  "keywords": ["整数规划", "调度"],
  "sections": [
    { "heading": "问题重述", "content": "题目要求给出调度方案……" },
    { "heading": "模型检验", "content": "结果对需求率参数敏感，结论需谨慎外推。" }
  ],
  "version": 1,
  "updated_at": "2026-08-27T01:40:00.000000Z"
}
